{
  "GSD": {
    "vendor_name": "Nginx",
    "product_name": "Nginx",
    "product_version": "all version",
    "vulnerability_type": "Unsafe default configuration values",
    "affected_component": "web server",
    "attack_vector": "network",
    "impact": "disclosure of information and availability",
    "credit": "",
    "references": [
      "https://www.nginx.com/blog/avoiding-top-10-nginx-configuration-mistakes/#unsecured-metrics",
      "https://news.ycombinator.com/item?id=30435282"
    ],
    "reporter": "kurtseifried",
    "reporter_id": 582211,
    "notes": "",
    "description": "# INFORMATIONAL\r\n\r\nIn Nginx, all versions,  a number of unsafe default configuration values exists in the web server that can be attacked via the network resulting in disclosure of information and availability. These include but are not limited to:\r\n\r\n1. Not enough file descriptors per worker\r\n2. The error_log off directive\r\n3. Not enabling keepalive connections to upstream servers\r\n4. Forgetting how directive inheritance works\r\n5. The proxy_buffering off directive\r\n6. Improper use of the if directive\r\n7. Excessive health checks\r\n8. Unsecured access to metrics\r\n9. Using ip_hash when all traffic comes from the same /24 CIDR block\r\n10. Not taking advantage of upstream groups\r\n"
  },
  "OSV": {
    "id": "GSD-2022-1000285",
    "modified": "2022-02-23T19:01:53.222611Z",
    "published": "2022-02-23T19:01:53.222611Z",
    "summary": "Unsafe default configuration values in Nginx version all version",
    "details": "# INFORMATIONAL\r\n\r\nIn Nginx, all versions,  a number of unsafe default configuration values exists in the web server that can be attacked via the network resulting in disclosure of information and availability. These include but are not limited to:\r\n\r\n1. Not enough file descriptors per worker\r\n2. The error_log off directive\r\n3. Not enabling keepalive connections to upstream servers\r\n4. Forgetting how directive inheritance works\r\n5. The proxy_buffering off directive\r\n6. Improper use of the if directive\r\n7. Excessive health checks\r\n8. Unsecured access to metrics\r\n9. Using ip_hash when all traffic comes from the same /24 CIDR block\r\n10. Not taking advantage of upstream groups\r\n",
    "affected": [
      {
        "package": {
          "name": "Nginx",
          "ecosystem": "GSD"
        },
        "versions": [
          "all version"
        ]
      }
    ],
    "references": [
      {
        "type": "WEB",
        "url": "https://www.nginx.com/blog/avoiding-top-10-nginx-configuration-mistakes/#unsecured-metrics"
      },
      {
        "type": "WEB",
        "url": "https://news.ycombinator.com/item?id=30435282"
      }
    ]
  }
}
